{
  "run_id": "CI-PILOT-001",
  "verifier": "verification-expert",
  "implementation_owner": "engineer-plus-codex",
  "independence_confirmed": true,
  "layers": {
    "implemented": "pass",
    "host": "not_applicable",
    "cross_build": "pass",
    "sil": "not_applicable",
    "device": "not_applicable",
    "hil": "not_applicable",
    "release": "not_applicable"
  },
  "overall": "PASS",
  "review_substitute": {
    "unavailable_reason": "Synthetic fixture has no independent reviewer.",
    "static_checks": {"status": "pass", "evidence_ref": "fixture://CI-PILOT-001/static-checks"},
    "hosted_ci": {"status": "pass", "evidence_ref": "fixture://CI-PILOT-001/hosted-ci"}
  },
  "evidence_refs": ["delivery-receipt.json", "fixture://CI-PILOT-001/static-checks", "fixture://CI-PILOT-001/hosted-ci"],
  "failures": [],
  "unverified_items": [],
  "risks": []
}
