{
  "run_id": "FEATURE-PCR02-OTA-001",
  "verifier": "github-actions/verify-ota",
  "implementation_owner": "engineer-plus-engineering-agent-runtime",
  "independence_confirmed": true,
  "layers": {"implemented": "pass", "host": "pass", "cross_build": "not_applicable", "sil": "not_applicable", "device": "not_applicable", "hil": "not_applicable", "release": "not_applicable"},
  "overall": "PASS",
  "review_substitute": {
    "unavailable_reason": "Independent Review was unavailable in the iterative Pilot; existing acceptance matrix records the permitted substitute. This is a structured restatement of retained evidence, not a fresh CI execution or independent Review PASS.",
    "static_checks": {"status": "pass", "evidence_ref": "https://github.com/jiying2007/ota_download_test/actions/runs/34861966225"},
    "hosted_ci": {"status": "pass", "evidence_ref": "https://github.com/jiying2007/ota_download_test/actions/runs/34862064742"}
  },
  "evidence_refs": ["https://github.com/jiying2007/ota_download_test/actions/runs/34861966225", "https://github.com/jiying2007/ota_download_test/actions/runs/34862064742", "retained receipt CI 34862735035 = success", "artifact 10355541476", "artifact archive sha256:5da3d9945051bc2741effa0064ae3ee4ef25cc31cf1c0372f393916596c3ab7a", "package sha256:7687d8058f85271e75ff3726957385afa1618aa2078dc0a6b3215d470af4a4bb", "real package bytes:76778472"],
  "failures": [],
  "unverified_items": ["Device OTA install/boot/rollback and release readiness are not part of this Feature Pilot.", "Historical CI references have not been rerun by this schema migration."],
  "risks": ["Independent Review unavailable in current stage; static/Hosted CI/Verification substitute is used without claiming Independent Review PASS."]
}
